{
  "schema": "synergy.organization.v1",
  "company_id": "synergy-ai-company",
  "company_name": "SYNERGY AI Company",
  "departments": [
    {
      "id": "leadership",
      "name": "AI Executive Office",
      "mission": "Translate human goals into company strategy and bounded missions.",
      "manager_employee_id": "ceo",
      "workspace": "departments/leadership",
      "memory_namespace": "org/leadership",
      "monthly_budget_microusd": 20000000,
      "allowed_capabilities": [
        "business.ceo.plan",
        "company.status",
        "intelligence.reason",
        "memory.search"
      ]
    },
    {
      "id": "sales",
      "name": "AI Sales Department",
      "mission": "Generate qualified pipeline, proposals and approved outreach.",
      "manager_employee_id": "sales-director",
      "workspace": "departments/sales",
      "memory_namespace": "org/sales",
      "monthly_budget_microusd": 30000000,
      "allowed_capabilities": [
        "business.sales.plan",
        "business.sales.compose_offer",
        "email.read",
        "email.send",
        "crm.read",
        "crm.record.create",
        "crm.record.update"
      ]
    },
    {
      "id": "marketing",
      "name": "AI Marketing & SMM",
      "mission": "Research audiences, plan content and manage approved publishing.",
      "manager_employee_id": "marketing-director",
      "workspace": "departments/marketing",
      "memory_namespace": "org/marketing",
      "monthly_budget_microusd": 25000000,
      "allowed_capabilities": [
        "business.smm.plan",
        "business.external.publish",
        "browser.navigate",
        "browser.snapshot",
        "intelligence.reason",
        "memory.search"
      ]
    },
    {
      "id": "finance",
      "name": "AI Finance Office",
      "mission": "Analyze budgets, margins, unit economics and operating status.",
      "manager_employee_id": "cfo",
      "workspace": "departments/finance",
      "memory_namespace": "org/finance",
      "monthly_budget_microusd": 10000000,
      "allowed_capabilities": [
        "business.cfo.analyze",
        "company.status",
        "database.query",
        "intelligence.reason"
      ]
    },
    {
      "id": "research",
      "name": "AI Research & Intelligence",
      "mission": "Collect evidence, reason over sources and maintain institutional memory.",
      "manager_employee_id": "research-director",
      "workspace": "departments/research",
      "memory_namespace": "org/research",
      "monthly_budget_microusd": 20000000,
      "allowed_capabilities": [
        "memory.search",
        "memory.upsert",
        "intelligence.infer",
        "intelligence.reason",
        "browser.navigate",
        "browser.snapshot",
        "database.query"
      ]
    },
    {
      "id": "product",
      "name": "AI Product Department",
      "mission": "Turn evidence and opportunities into product decisions and requirements.",
      "manager_employee_id": "product-director",
      "workspace": "departments/product",
      "memory_namespace": "org/product",
      "monthly_budget_microusd": 12000000,
      "allowed_capabilities": [
        "intelligence.reason",
        "memory.search",
        "browser.snapshot",
        "company.opportunity.ingest"
      ]
    },
    {
      "id": "engineering",
      "name": "AI Engineering",
      "mission": "Build, modify and verify software through bounded computer and agent tools.",
      "manager_employee_id": "cto",
      "workspace": "departments/engineering",
      "memory_namespace": "org/engineering",
      "monthly_budget_microusd": 30000000,
      "allowed_capabilities": [
        "computer.read_file",
        "computer.write_file",
        "computer.run_command",
        "computer.system_info",
        "worker.schedule",
        "worker.lease",
        "intelligence.reason"
      ]
    },
    {
      "id": "quality",
      "name": "AI QA & Security",
      "mission": "Independently verify correctness, evidence and security boundaries.",
      "manager_employee_id": "qa-director",
      "workspace": "departments/quality",
      "memory_namespace": "org/quality",
      "monthly_budget_microusd": 12000000,
      "allowed_capabilities": [
        "computer.read_file",
        "computer.system_info",
        "browser.snapshot",
        "business.verify.evidence",
        "intelligence.reason"
      ]
    },
    {
      "id": "operations",
      "name": "AI Operations & Automation",
      "mission": "Run schedules, queues, calendars and approved operational integrations.",
      "manager_employee_id": "ops-director",
      "workspace": "departments/operations",
      "memory_namespace": "org/operations",
      "monthly_budget_microusd": 15000000,
      "allowed_capabilities": [
        "calendar.read",
        "calendar.event.create",
        "calendar.event.update",
        "queue.publish",
        "queue.consume",
        "http.request",
        "company.status"
      ]
    },
    {
      "id": "success",
      "name": "AI CRM & Customer Success",
      "mission": "Maintain customer context and execute approved service communications.",
      "manager_employee_id": "success-director",
      "workspace": "departments/success",
      "memory_namespace": "org/success",
      "monthly_budget_microusd": 18000000,
      "allowed_capabilities": [
        "crm.read",
        "crm.record.update",
        "email.read",
        "email.send",
        "calendar.read",
        "calendar.event.create",
        "business.sales.plan"
      ]
    },
    {
      "id": "creative",
      "name": "AI Creative Studio",
      "mission": "Create sales, content and visual briefs and persist approved artifacts.",
      "manager_employee_id": "creative-director",
      "workspace": "departments/creative",
      "memory_namespace": "org/creative",
      "monthly_budget_microusd": 15000000,
      "allowed_capabilities": [
        "business.smm.plan",
        "business.sales.compose_offer",
        "browser.snapshot",
        "computer.write_file",
        "intelligence.reason"
      ]
    },
    {
      "id": "infra",
      "name": "AI Distributed Infrastructure",
      "mission": "Operate local/remote nodes and agent-fabric scheduling within policy.",
      "manager_employee_id": "infra-director",
      "workspace": "departments/infra",
      "memory_namespace": "org/infra",
      "monthly_budget_microusd": 20000000,
      "allowed_capabilities": [
        "computer.remote.list_dir",
        "computer.remote.read_file",
        "computer.remote.run",
        "worker.schedule",
        "worker.lease",
        "computer.system_info"
      ]
    }
  ],
  "employees": [
    {
      "id": "ceo",
      "name": "Astra",
      "title": "AI CEO",
      "department_id": "leadership",
      "supervisor_id": null,
      "instructions": "Operate as AI CEO. Produce evidence, obey typed contracts, department policy, budgets and approval gates.",
      "capabilities": [
        "business.ceo.plan",
        "company.status",
        "intelligence.reason",
        "memory.search"
      ],
      "tools": [],
      "max_risk": "High",
      "model_policy": "outcome-aware-balanced",
      "device_policy": "local-first-agent-fabric",
      "workspace": "departments/leadership/ceo",
      "memory_namespace": "org/leadership/ceo",
      "autonomous": true
    },
    {
      "id": "strategy-analyst",
      "name": "Nova",
      "title": "AI Strategy Analyst",
      "department_id": "leadership",
      "supervisor_id": "ceo",
      "instructions": "Operate as AI Strategy Analyst. Produce evidence, obey typed contracts, department policy, budgets and approval gates.",
      "capabilities": [
        "company.status",
        "intelligence.reason",
        "memory.search"
      ],
      "tools": [],
      "max_risk": "Medium",
      "model_policy": "outcome-aware-balanced",
      "device_policy": "local-first-agent-fabric",
      "workspace": "departments/leadership/strategy-analyst",
      "memory_namespace": "org/leadership/strategy-analyst",
      "autonomous": true
    },
    {
      "id": "sales-director",
      "name": "Orion",
      "title": "AI Sales Director",
      "department_id": "sales",
      "supervisor_id": null,
      "instructions": "Operate as AI Sales Director. Produce evidence, obey typed contracts, department policy, budgets and approval gates.",
      "capabilities": [
        "business.sales.plan",
        "business.sales.compose_offer",
        "crm.read"
      ],
      "tools": [],
      "max_risk": "High",
      "model_policy": "outcome-aware-balanced",
      "device_policy": "local-first-agent-fabric",
      "workspace": "departments/sales/sales-director",
      "memory_namespace": "org/sales/sales-director",
      "autonomous": true
    },
    {
      "id": "sales-researcher",
      "name": "Scout",
      "title": "AI Lead Researcher",
      "department_id": "sales",
      "supervisor_id": "sales-director",
      "instructions": "Operate as AI Lead Researcher. Produce evidence, obey typed contracts, department policy, budgets and approval gates.",
      "capabilities": [
        "business.sales.plan",
        "crm.read",
        "email.read"
      ],
      "tools": [],
      "max_risk": "Medium",
      "model_policy": "outcome-aware-balanced",
      "device_policy": "local-first-agent-fabric",
      "workspace": "departments/sales/sales-researcher",
      "memory_namespace": "org/sales/sales-researcher",
      "autonomous": true
    },
    {
      "id": "sales-copy",
      "name": "Maya",
      "title": "AI Proposal & Outreach Specialist",
      "department_id": "sales",
      "supervisor_id": "sales-director",
      "instructions": "Operate as AI Proposal & Outreach Specialist. Produce evidence, obey typed contracts, department policy, budgets and approval gates.",
      "capabilities": [
        "business.sales.compose_offer",
        "email.send"
      ],
      "tools": [],
      "max_risk": "High",